<!ELEMENT booklist (book+)>
<!ELEMENT book (title, author, publisher, price, ISBN)>
<!ATTLIST book
          kind CDATA #REQUIRED>
<!ELEMENT title (#PCDATA)>
<!ELEMENT author (#PCDATA)>
<!ELEMENT publisher (#PCDATA)>
<!ELEMENT price (#PCDATA)>
<!ELEMENT ISBN (#PCDATA)>
